Date,News,Negative,Neutral,Positive
01-06-2020,"These were the 10 most popular stocks on Robinhood in the month of May (AAPL, F, CCL, DAL, AAL, MSFT, GPRO, ACB, DIS, GE)",0.0,0.881,0.119
02-06-2020,A billionaire tech investor is calling out Apple CEO Tim Cook for not speaking up publicly about the company's values amid protests over George Floyd's death (AAPL),0.184,0.73,0.086
02-06-2020,HSBC Direct Savings is an online-only account with a high APY and a $1 opening deposit,0.0,1.0,0.0
02-06-2020,"How to schedule a Google Meet appointment for later, or start a meeting immediately",0.0,1.0,0.0
02-06-2020,"HBO Max's movie library is better than Netflix and Hulu, but with no 4K playback or support for Roku and Fire TV, it's hard to justify the streaming service's $15 a month price",0.188,0.675,0.138
02-06-2020,10 things in tech you need to know today,0.0,1.0,0.0
02-06-2020,"Silicon Valley billionaires are lining up to condemn racism. But the tech and VC industry has a shameful, decades-long history of ignoring and perpetuating inequality. (AAPL, CRM, GOOG, FB, NFLX, INTC)",0.326,0.674,0.0
02-06-2020,"Amazon raised $10 billion in the bond markets, including $1 billion of debt yielding just 0.4% — reportedly the lowest rate in the history of US corporate bonds (AMZN)",0.16,0.786,0.053
02-06-2020,"How to find the IP address of your internet router using a Mac, PC, iPhone, or Android",0.0,1.0,0.0
02-06-2020,"Smartphone sales have plummeted, and Huawei is taking the biggest hit",0.0,1.0,0.0
02-06-2020,"Amazon raised $10 billion in the bond markets, including $1 billion of debt yielding just 0.4% — reportedly the lowest rate in the history of US corporate bonds",0.166,0.779,0.055
02-06-2020,'Just Mercy' is now free to stream through the month of June to help educate people on systemic racism,0.149,0.543,0.308
02-06-2020,"The US chairman of PwC explains how to stand out in a sea of job-seekers, what it takes to make partner at his firm, and where he gets his best ideas for building a diverse workforce",0.0,0.887,0.113
02-06-2020,An ex-Facebook spokesperson says he was 'wrong' about the company's free-speech mission counteracting ignorance and is urging employees to take action (FB),0.106,0.894,0.0
02-06-2020,There's no reason to spend hundreds of dollars on cast iron cookware,0.167,0.833,0.0
03-06-2020,"Time spent with podcasts will decrease after years of strong growth, but should rebound by 2022",0.0,0.78,0.22
03-06-2020,$3 billion Carta is looking for a new COO and WeWork's former CEO just turned down the job,0.0,1.0,0.0
03-06-2020,THE STATE OF VIRTUAL CARE IN THE US: The coronavirus is pushing telehealth into the mainstream — here's how traditional healthcare players are using it to retain business now and where the market is headed,0.0,0.894,0.106
03-06-2020,These former Apple execs have a track record of spotting unicorns. They've identified 3 post-crisis startup themes for a new $90 million fund.,0.0,1.0,0.0
03-06-2020,"I took a bunch of photos the iPhone 11 Pro Max and the Galaxy S20 Ultra, and it's clear that Apple and Samsung have very different ideas of what makes a good photo",0.0,0.836,0.164
03-06-2020,How to check your edit history on Google Docs in 3 simple steps,0.0,1.0,0.0
03-06-2020,'Words by themselves are empty': Andreessen Horowitz is launching a new nonprofit fund to invest in founders that 'lack the typical background and resources' to get on Silicon Valley's fast track to success.,0.064,0.833,0.103
03-06-2020,"Apple's App Store sales have grown nearly twice as fast as this top Wall Street analyst predicted, as services are softening the blow from slowing iPhone sales (APPL)",0.0,0.931,0.069
03-06-2020,Snapchat will stop promoting President Trump's account in Discover: 'We will not amplify voices who incite racial violence and injustice' (SNAP),0.339,0.576,0.085
03-06-2020,How to accept a Google Calendar invite on your computer or mobile device,0.0,0.704,0.296
03-06-2020,"This little-known children's media company has skyrocketed 2,500% since May (GNUS)",0.0,1.0,0.0
03-06-2020,Early former Facebook employees wrote a letter to the company's leaders criticizing its 'cowardly' decision not to take action against Trump's posts (FB),0.106,0.894,0.0
03-06-2020,Ben & Jerry's calls on Americans to combat white supremacy in a blistering statement building on its multi-year campaign against racial inequality,0.111,0.833,0.056
03-06-2020,The fire Zuck started won't stop at Facebook,0.233,0.583,0.184
03-06-2020,How to watch UFC 250: Current double champion Amanda Nunes takes on up-and-comer Felicia Spencer,0.0,0.782,0.218
03-06-2020,"Wealthfront's cash account now has a debit card and direct deposit, making it more like a hybrid checking and savings account",0.0,0.866,0.134
